{
  "ledgerVersion": "2",
  "artifact": {
    "path": "design-tokens/dist/figma/tokens.json",
    "revision": "2ee89e27306a1caa846d904ad6229370f371b1b3"
  },
  "publish": {
    "mode": "plugin-import-manual",
    "tokensStudioCarrier": false,
    "figmaFile": "figma://file/23PLdynlRYoBYQx9teoC8A"
  },
  "verification": {
    "materializationStatus": "passed",
    "lastVerifiedRevision": "2ee89e27306a1caa846d904ad6229370f371b1b3"
  },
  "promotion": {
    "parityMode": "deferred",
    "parityDeferredReason": "Parity remains deferred because the hardened Variables API rail and release-governed promotion gate are not yet in place for Collider.",
    "highestEarnedLevel": "D-publish-valid"
  },
  "exceptions": []
}
